{
  "agent_id": "0x4c399b1cfd777c598778cfcdefdea719b040cc331ac368cba4957cb221ab7376",
  "client_id": "0xce665c932b8b6adb314bf6ba6b5561b528027ce19de675f4c3136d7f91bf23a8",
  "action": "PAY_INVOICE",
  "ref_id": "0x0665d8d815dfef587a495604ca870d4b3f510bfaabe41553ad691024b8d4b49c",
  "document": "Facture synthétique. Merci de payer sous 30 jours."
}
