{
  "agent_id": "0x3b012bc1ee917e20bc9fd4e7e96949b845385fe2337c9b7e57ddb78612a22c78",
  "client_id": "0xce665c932b8b6adb314bf6ba6b5561b528027ce19de675f4c3136d7f91bf23a8",
  "action": "PLACE",
  "ref_id": "0x4253f8c51272c785bd58704a4d22f7205299f6bf601dc39e6e0b8a72c58ca0da",
  "document": "Ordre de placement synthétique."
}
